{
  "description": "JSONSchemaProps is a JSON-Schema following Specification Draft 4 (http://json-schema.org/).",
  "type": "object",
  "properties": {
    "$ref": {
      "type": [
        "string",
        "null"
      ]
    },
    "$schema": {
      "type": [
        "string",
        "null"
      ]
    },
    "additionalItems": {
      "$ref": "_definitions.json#/definitions/io.k8s.apiextensions-apiserver.pkg.apis.apiextensions.v1.JSONSchemaPropsOrBool"
    },
    "additionalProperties": {
      "$ref": "_definitions.json#/definitions/io.k8s.apiextensions-apiserver.pkg.apis.apiextensions.v1.JSONSchemaPropsOrBool"
    },
    "allOf": {
      "type": [
        "array",
        "null"
      ],
      "items": {
        "$ref": "_definitions.json#/definitions/io.k8s.apiextensions-apiserver.pkg.apis.apiextensions.v1.JSONSchemaProps"
      }
    },
    "anyOf": {
      "type": [
        "array",
        "null"
      ],
      "items": {
        "$ref": "_definitions.json#/definitions/io.k8s.apiextensions-apiserver.pkg.apis.apiextensions.v1.JSONSchemaProps"
      }
    },
    "default": {
      "description": "default is a default value for undefined object fields. Defaulting is a beta feature under the CustomResourceDefaulting feature gate. Defaulting requires spec.preserveUnknownFields to be false.",
      "$ref": "_definitions.json#/definitions/io.k8s.apiextensions-apiserver.pkg.apis.apiextensions.v1.JSON"
    },
    "definitions": {
      "type": [
        "object",
        "null"
      ],
      "additionalProperties": {
        "$ref": "_definitions.json#/definitions/io.k8s.apiextensions-apiserver.pkg.apis.apiextensions.v1.JSONSchemaProps"
      }
    },
    "dependencies": {
      "type": [
        "object",
        "null"
      ],
      "additionalProperties": {
        "$ref": "_definitions.json#/definitions/io.k8s.apiextensions-apiserver.pkg.apis.apiextensions.v1.JSONSchemaPropsOrStringArray"
      }
    },
    "description": {
      "type": [
        "string",
        "null"
      ]
    },
    "enum": {
      "type": [
        "array",
        "null"
      ],
      "items": {
        "$ref": "_definitions.json#/definitions/io.k8s.apiextensions-apiserver.pkg.apis.apiextensions.v1.JSON"
      }
    },
    "example": {
      "$ref": "_definitions.json#/definitions/io.k8s.apiextensions-apiserver.pkg.apis.apiextensions.v1.JSON"
    },
    "exclusiveMaximum": {
      "type": [
        "boolean",
        "null"
      ]
    },
    "exclusiveMinimum": {
      "type": [
        "boolean",
        "null"
      ]
    },
    "externalDocs": {
      "$ref": "_definitions.json#/definitions/io.k8s.apiextensions-apiserver.pkg.apis.apiextensions.v1.ExternalDocumentation"
    },
    "format": {
      "description": "format is an OpenAPI v3 format string. Unknown formats are ignored. The following formats are validated:\n\n- bsonobjectid: a bson object ID, i.e. a 24 characters hex string - uri: an URI as parsed by Golang net/url.ParseRequestURI - email: an email address as parsed by Golang net/mail.ParseAddress - hostname: a valid representation for an Internet host name, as defined by RFC 1034, section 3.1 [RFC1034]. - ipv4: an IPv4 IP as parsed by Golang net.ParseIP - ipv6: an IPv6 IP as parsed by Golang net.ParseIP - cidr: a CIDR as parsed by Golang net.ParseCIDR - mac: a MAC address as parsed by Golang net.ParseMAC - uuid: an UUID that allows uppercase defined by the regex (?i)^[0-9a-f]{8}-?[0-9a-f]{4}-?[0-9a-f]{4}-?[0-9a-f]{4}-?[0-9a-f]{12}$ - uuid3: an UUID3 that allows uppercase defined by the regex (?i)^[0-9a-f]{8}-?[0-9a-f]{4}-?3[0-9a-f]{3}-?[0-9a-f]{4}-?[0-9a-f]{12}$ - uuid4: an UUID4 that allows uppercase defined by the regex (?i)^[0-9a-f]{8}-?[0-9a-f]{4}-?4[0-9a-f]{3}-?[89ab][0-9a-f]{3}-?[0-9a-f]{12}$ - uuid5: an UUID5 that allows uppercase defined by the regex (?i)^[0-9a-f]{8}-?[0-9a-f]{4}-?5[0-9a-f]{3}-?[89ab][0-9a-f]{3}-?[0-9a-f]{12}$ - isbn: an ISBN10 or ISBN13 number string like \"0321751043\" or \"978-0321751041\" - isbn10: an ISBN10 number string like \"0321751043\" - isbn13: an ISBN13 number string like \"978-0321751041\" - creditcard: a credit card number defined by the regex ^(?:4[0-9]{12}(?:[0-9]{3})?|5[1-5][0-9]{14}|6(?:011|5[0-9][0-9])[0-9]{12}|3[47][0-9]{13}|3(?:0[0-5]|[68][0-9])[0-9]{11}|(?:2131|1800|35\\d{3})\\d{11})$ with any non digit characters mixed in - ssn: a U.S. social security number following the regex ^\\d{3}[- ]?\\d{2}[- ]?\\d{4}$ - hexcolor: an hexadecimal color code like \"#FFFFFF: following the regex ^#?([0-9a-fA-F]{3}|[0-9a-fA-F]{6})$ - rgbcolor: an RGB color code like rgb like \"rgb(255,255,2559\" - byte: base64 encoded binary data - password: any kind of string - date: a date string like \"2006-01-02\" as defined by full-date in RFC3339 - duration: a duration string like \"22 ns\" as parsed by Golang time.ParseDuration or compatible with Scala duration format - datetime: a date time string like \"2014-12-15T19:30:20.000Z\" as defined by date-time in RFC3339.",
      "type": [
        "string",
        "null"
      ]
    },
    "id": {
      "type": [
        "string",
        "null"
      ]
    },
    "items": {
      "$ref": "_definitions.json#/definitions/io.k8s.apiextensions-apiserver.pkg.apis.apiextensions.v1.JSONSchemaPropsOrArray"
    },
    "maxItems": {
      "type": [
        "integer",
        "null"
      ],
      "format": "int64"
    },
    "maxLength": {
      "type": [
        "integer",
        "null"
      ],
      "format": "int64"
    },
    "maxProperties": {
      "type": [
        "integer",
        "null"
      ],
      "format": "int64"
    },
    "maximum": {
      "type": [
        "number",
        "null"
      ],
      "format": "double"
    },
    "minItems": {
      "type": [
        "integer",
        "null"
      ],
      "format": "int64"
    },
    "minLength": {
      "type": [
        "integer",
        "null"
      ],
      "format": "int64"
    },
    "minProperties": {
      "type": [
        "integer",
        "null"
      ],
      "format": "int64"
    },
    "minimum": {
      "type": [
        "number",
        "null"
      ],
      "format": "double"
    },
    "multipleOf": {
      "type": [
        "number",
        "null"
      ],
      "format": "double"
    },
    "not": {
      "$ref": "_definitions.json#/definitions/io.k8s.apiextensions-apiserver.pkg.apis.apiextensions.v1.JSONSchemaProps"
    },
    "nullable": {
      "type": [
        "boolean",
        "null"
      ]
    },
    "oneOf": {
      "type": [
        "array",
        "null"
      ],
      "items": {
        "$ref": "_definitions.json#/definitions/io.k8s.apiextensions-apiserver.pkg.apis.apiextensions.v1.JSONSchemaProps"
      }
    },
    "pattern": {
      "type": [
        "string",
        "null"
      ]
    },
    "patternProperties": {
      "type": [
        "object",
        "null"
      ],
      "additionalProperties": {
        "$ref": "_definitions.json#/definitions/io.k8s.apiextensions-apiserver.pkg.apis.apiextensions.v1.JSONSchemaProps"
      }
    },
    "properties": {
      "type": [
        "object",
        "null"
      ],
      "additionalProperties": {
        "$ref": "_definitions.json#/definitions/io.k8s.apiextensions-apiserver.pkg.apis.apiextensions.v1.JSONSchemaProps"
      }
    },
    "required": {
      "type": [
        "array",
        "null"
      ],
      "items": {
        "type": "string"
      }
    },
    "title": {
      "type": [
        "string",
        "null"
      ]
    },
    "type": {
      "type": [
        "string",
        "null"
      ]
    },
    "uniqueItems": {
      "type": [
        "boolean",
        "null"
      ]
    },
    "x-kubernetes-embedded-resource": {
      "description": "x-kubernetes-embedded-resource defines that the value is an embedded Kubernetes runtime.Object, with TypeMeta and ObjectMeta. The type must be object. It is allowed to further restrict the embedded object. kind, apiVersion and metadata are validated automatically. x-kubernetes-preserve-unknown-fields is allowed to be true, but does not have to be if the object is fully specified (up to kind, apiVersion, metadata).",
      "type": [
        "boolean",
        "null"
      ]
    },
    "x-kubernetes-int-or-string": {
      "description": "x-kubernetes-int-or-string specifies that this value is either an integer or a string. If this is true, an empty type is allowed and type as child of anyOf is permitted if following one of the following patterns:\n\n1) anyOf:\n   - type: integer\n   - type: string\n2) allOf:\n   - anyOf:\n     - type: integer\n     - type: string\n   - ... zero or more",
      "type": [
        "boolean",
        "null"
      ]
    },
    "x-kubernetes-list-map-keys": {
      "description": "x-kubernetes-list-map-keys annotates an array with the x-kubernetes-list-type `map` by specifying the keys used as the index of the map.\n\nThis tag MUST only be used on lists that have the \"x-kubernetes-list-type\" extension set to \"map\". Also, the values specified for this attribute must be a scalar typed field of the child structure (no nesting is supported).\n\nThe properties specified must either be required or have a default value, to ensure those properties are present for all list items.",
      "type": [
        "array",
        "null"
      ],
      "items": {
        "type": "string"
      }
    },
    "x-kubernetes-list-type": {
      "description": "x-kubernetes-list-type annotates an array to further describe its topology. This extension must only be used on lists and may have 3 possible values:\n\n1) `atomic`: the list is treated as a single entity, like a scalar.\n     Atomic lists will be entirely replaced when updated. This extension\n     may be used on any type of list (struct, scalar, ...).\n2) `set`:\n     Sets are lists that must not have multiple items with the same value. Each\n     value must be a scalar, an object with x-kubernetes-map-type `atomic` or an\n     array with x-kubernetes-list-type `atomic`.\n3) `map`:\n     These lists are like maps in that their elements have a non-index key\n     used to identify them. Order is preserved upon merge. The map tag\n     must only be used on a list with elements of type object.\nDefaults to atomic for arrays.",
      "type": [
        "string",
        "null"
      ]
    },
    "x-kubernetes-map-type": {
      "description": "x-kubernetes-map-type annotates an object to further describe its topology. This extension must only be used when type is object and may have 2 possible values:\n\n1) `granular`:\n     These maps are actual maps (key-value pairs) and each fields are independent\n     from each other (they can each be manipulated by separate actors). This is\n     the default behaviour for all maps.\n2) `atomic`: the list is treated as a single entity, like a scalar.\n     Atomic maps will be entirely replaced when updated.",
      "type": [
        "string",
        "null"
      ]
    },
    "x-kubernetes-preserve-unknown-fields": {
      "description": "x-kubernetes-preserve-unknown-fields stops the API server decoding step from pruning fields which are not specified in the validation schema. This affects fields recursively, but switches back to normal pruning behaviour if nested properties or additionalProperties are specified in the schema. This can either be true or undefined. False is forbidden.",
      "type": [
        "boolean",
        "null"
      ]
    }
  },
  "$schema": "http://json-schema.org/schema#"
}