{
  "description": "BallastConfig is the Schema for the ballastconfigs API",
  "properties": {
    "apiVersion": {
      "description": "APIVersion defines the versioned schema of this representation of an object.\nServers should convert recognized schemas to the latest internal value, and\nmay reject unrecognized values.\nMore info: https://git.k8s.io/community/contributors/devel/sig-architecture/api-conventions.md#resources",
      "type": "string"
    },
    "kind": {
      "description": "Kind is a string value representing the REST resource this object represents.\nServers may infer this from the endpoint the client submits requests to.\nCannot be updated.\nIn CamelCase.\nMore info: https://git.k8s.io/community/contributors/devel/sig-architecture/api-conventions.md#types-kinds",
      "type": "string"
    },
    "metadata": {
      "type": "object"
    },
    "spec": {
      "description": "spec defines the desired state of BallastConfig",
      "properties": {
        "identityLabels": {
          "description": "IdentityLabels is the ordered list of pod label keys that define a\nWorkloadProfile identity tuple. Must be set at install time.\nChanging this after enrollment requires a migration.",
          "items": {
            "type": "string"
          },
          "minItems": 1,
          "type": "array"
        },
        "orphanTTL": {
          "default": "168h",
          "description": "OrphanTTL is how long to retain an Orphaned WorkloadProfile before deleting it.",
          "type": "string"
        },
        "retentionWindow": {
          "default": "168h",
          "description": "RetentionWindow is the default Redis sample retention window.",
          "type": "string"
        },
        "suspended": {
          "default": false,
          "description": "Suspended halts all Ballast actions when true.\nEquivalent to the emergency kill-switch ConfigMap.",
          "type": "boolean"
        }
      },
      "required": [
        "identityLabels"
      ],
      "type": "object",
      "additionalProperties": false
    },
    "status": {
      "description": "status defines the observed state of BallastConfig",
      "type": "object"
    }
  },
  "required": [
    "spec"
  ],
  "type": "object"
}
