{
  "description": "ComputeTargetInstance is the Schema for the compute API",
  "properties": {
    "apiVersion": {
      "description": "APIVersion defines the versioned schema of this representation of an object. Servers should convert recognized schemas to the latest internal value, and may reject unrecognized values. More info: https://git.k8s.io/community/contributors/devel/sig-architecture/api-conventions.md#resources",
      "type": "string"
    },
    "kind": {
      "description": "Kind is a string value representing the REST resource this object represents. Servers may infer this from the endpoint the client submits requests to. Cannot be updated. In CamelCase. More info: https://git.k8s.io/community/contributors/devel/sig-architecture/api-conventions.md#types-kinds",
      "type": "string"
    },
    "metadata": {
      "type": "object"
    },
    "spec": {
      "description": "ComputeTargetInstanceSpec defines the desired state of ComputeTargetInstance",
      "properties": {
        "description": {
          "description": "Immutable. An optional description of this resource.",
          "type": "string"
        },
        "instanceRef": {
          "description": "The ComputeInstance handling traffic for this target instance.",
          "oneOf": [
            {
              "not": {
                "required": [
                  "external"
                ]
              },
              "required": [
                "name"
              ]
            },
            {
              "not": {
                "anyOf": [
                  {
                    "required": [
                      "name"
                    ]
                  },
                  {
                    "required": [
                      "namespace"
                    ]
                  }
                ]
              },
              "required": [
                "external"
              ]
            }
          ],
          "properties": {
            "external": {
              "description": "A reference to an externally managed ComputeInstance resource. Should be in the format \"projects/{{projectID}}/zones/{{zone}}/instances/{{instanceID}}\".",
              "type": "string"
            },
            "name": {
              "description": "The name of a ComputeInstance resource.",
              "type": "string"
            },
            "namespace": {
              "description": "The namespace of a ComputeInstance resource.",
              "type": "string"
            }
          },
          "type": "object",
          "additionalProperties": false
        },
        "natPolicy": {
          "description": "Immutable. NAT option controlling how IPs are NAT'ed to the instance. Currently only NO_NAT (default value) is supported. Default value: \"NO_NAT\" Possible values: [\"NO_NAT\"].",
          "type": "string"
        },
        "networkRef": {
          "description": "The network this target instance uses to forward traffic. If not specified, the traffic will be forwarded to the network that the default network interface belongs to.",
          "oneOf": [
            {
              "not": {
                "required": [
                  "external"
                ]
              },
              "required": [
                "name"
              ]
            },
            {
              "not": {
                "anyOf": [
                  {
                    "required": [
                      "name"
                    ]
                  },
                  {
                    "required": [
                      "namespace"
                    ]
                  }
                ]
              },
              "required": [
                "external"
              ]
            }
          ],
          "properties": {
            "external": {
              "description": "A reference to an externally managed ComputeNetwork resource. Should be in the format \"projects/{{projectID}}/global/networks/{{networkID}}\".",
              "type": "string"
            },
            "name": {
              "description": "The name of a ComputeNetwork resource.",
              "type": "string"
            },
            "namespace": {
              "description": "The namespace of a ComputeNetwork resource.",
              "type": "string"
            }
          },
          "type": "object",
          "additionalProperties": false
        },
        "resourceID": {
          "description": "Immutable. Optional. The name of the resource. Used for creation and acquisition. When unset, the value of `metadata.name` is used as the default.",
          "type": "string"
        },
        "securityPolicyRef": {
          "description": "The resource URL for the security policy associated with this target instance.",
          "oneOf": [
            {
              "not": {
                "required": [
                  "external"
                ]
              },
              "required": [
                "name"
              ]
            },
            {
              "not": {
                "anyOf": [
                  {
                    "required": [
                      "name"
                    ]
                  },
                  {
                    "required": [
                      "namespace"
                    ]
                  }
                ]
              },
              "required": [
                "external"
              ]
            }
          ],
          "properties": {
            "external": {
              "description": "A reference to an externally managed ComputeSecurityPolicy resource. Should be in the format \"projects/{{projectID}}/global/securityPolicies/{{name}}\".",
              "type": "string"
            },
            "name": {
              "description": "The name of a ComputeSecurityPolicy resource.",
              "type": "string"
            },
            "namespace": {
              "description": "The namespace of a ComputeSecurityPolicy resource.",
              "type": "string"
            }
          },
          "type": "object",
          "additionalProperties": false
        },
        "zone": {
          "description": "Immutable. URL of the zone where the target instance resides.",
          "type": "string"
        }
      },
      "required": [
        "instanceRef",
        "zone"
      ],
      "type": "object",
      "additionalProperties": false
    },
    "status": {
      "description": "ComputeTargetInstanceStatus defines the config connector machine state of ComputeTargetInstance",
      "properties": {
        "conditions": {
          "description": "Conditions represent the latest available observations of the ComputeTargetInstance's current state.",
          "items": {
            "properties": {
              "lastTransitionTime": {
                "description": "Last time the condition transitioned from one status to another.",
                "type": "string"
              },
              "message": {
                "description": "Human-readable message indicating details about last transition.",
                "type": "string"
              },
              "reason": {
                "description": "Unique, one-word, CamelCase reason for the condition's last transition.",
                "type": "string"
              },
              "status": {
                "description": "Status is the status of the condition. Can be True, False, Unknown.",
                "type": "string"
              },
              "type": {
                "description": "Type is the type of the condition.",
                "type": "string"
              }
            },
            "type": "object",
            "additionalProperties": false
          },
          "type": "array"
        },
        "creationTimestamp": {
          "description": "Creation timestamp in RFC3339 text format.",
          "type": "string"
        },
        "observedGeneration": {
          "description": "ObservedGeneration is the generation of the resource that was most recently observed by the Config Connector controller. If this is equal to metadata.generation, then that means that the current reported status reflects the most recent desired state of the resource.",
          "format": "int64",
          "type": "integer"
        },
        "selfLink": {
          "type": "string"
        }
      },
      "type": "object",
      "additionalProperties": false
    }
  },
  "required": [
    "spec"
  ],
  "type": "object"
}
