{
  "description": "IPAMConfiguration contains information about a block for IP address assignment.",
  "properties": {
    "apiVersion": {
      "description": "APIVersion defines the versioned schema of this representation of an object.\nServers should convert recognized schemas to the latest internal value, and\nmay reject unrecognized values.\nMore info: https://git.k8s.io/community/contributors/devel/sig-architecture/api-conventions.md#resources",
      "type": "string"
    },
    "kind": {
      "description": "Kind is a string value representing the REST resource this object represents.\nServers may infer this from the endpoint the client submits requests to.\nCannot be updated.\nIn CamelCase.\nMore info: https://git.k8s.io/community/contributors/devel/sig-architecture/api-conventions.md#types-kinds",
      "type": "string"
    },
    "metadata": {
      "type": "object"
    },
    "spec": {
      "description": "IPAMConfigurationSpec contains the specification for an IPAMConfiguration resource.",
      "properties": {
        "autoAllocateBlocks": {
          "default": true,
          "description": "Whether or not to auto allocate blocks to hosts.",
          "type": "boolean"
        },
        "ipCooldownSeconds": {
          "description": "IPCooldownSeconds is the minimum age of a released IP in a block before it is re-used.\nIf set to zero, IPs can be re-used immediately (but are still handled with a FIFO queue to\nminimize immediate reuse).",
          "format": "int32",
          "maximum": 1200,
          "minimum": 0,
          "type": "integer"
        },
        "kubeVirtVMAddressPersistence": {
          "description": "KubeVirtVMAddressPersistence controls whether KubeVirt VirtualMachine workloads\nmaintain persistent IP addresses across VM lifecycle events (reboot, migration, pod eviction).\nWhen Enabled, Calico automatically ensures that KubeVirt VMs retain their IP addresses\nwhen their underlying pods are recreated during VM operations.\nWhen Disabled, VMs receive new IP addresses whenever their pods are recreated,\nand creating a live migration target pod is not supported because the migration\ntarget pod requires the same IP as the source pod, which is only possible with\naddress persistence.\nDefaults to Enabled if not specified.",
          "enum": [
            "Enabled",
            "Disabled"
          ],
          "type": "string"
        },
        "maxBlocksPerHost": {
          "default": 0,
          "description": "MaxBlocksPerHost, if non-zero, is the max number of blocks that can be\naffine to each host.",
          "format": "int32",
          "maximum": 1000000,
          "minimum": 0,
          "type": "integer"
        },
        "strictAffinity": {
          "default": false,
          "description": "When StrictAffinity is true, borrowing IP addresses is not allowed.",
          "type": "boolean"
        }
      },
      "required": [
        "autoAllocateBlocks",
        "strictAffinity"
      ],
      "type": "object",
      "additionalProperties": false
    }
  },
  "required": [
    "metadata",
    "spec"
  ],
  "type": "object"
}
